,Clean_Content,Kategorisierung
207,do you manage research data at your university or institution download australia s new research data management framework for institutions including reusable resources to uplift rdm at your institution https t co zgjq cgj fairdata researchdata guide,Initiative
208,listen to alan morrison s interview with andrew padilla on episode of the fair data forecast as they talk about the importance of fair data and knowledge dna dsc datasciencecentral datascience fairdata data https t co kup vgjmk,Meinung
209,rt datasciencectrl listen to alan morrison s interview with andrew padilla on episode of the fair data forecast as they talk about the importance of fair data and knowledge dna dsc datasciencecentral datascience fairdata data https t co asgqvfclub,Meinung
210,listen to alan morrison s interview with andrew padilla on episode of the fair data forecast as they talk about the importance of fair data and knowledge dna dsc datasciencecentral datascience fairdata data https t co addp aekg,Meinung
211,the codata rda school of research data science has created a summer school style curriculum that meets the training needs the deadline for registration is march register here https t co tvyxwaq x codata fairdata openscience datascience opendata openscience https t co fs rlxhvl,Veranstaltung
212,farragher jmburns coffeyaoife jennyolibrarian name checked during jmburns talk expect more invitations to explore rdm opendata fairdata with hslg librarians,Veranstaltung
213,earneco only shows adverts to willing consumers who have pre selected their interests and are active participants in the exchange of advertising for their attention empoweredads fairdata earneco https t co iofyyfpion,Meinung
214,get to know our fair implementation team it will ensure coherent coordination of fair impact use cases have an active role in supporting the adoption of fairdata practices policies and tools while managing cascading grants for a more openscience https t co zrejka ivv https t co yabedoyiyu,Meinung
215,newspecies allium sunhangii a newly discovered amaryllidaceae from uzbekistan treatment https t co htyogagi f publication https t co loetqqouqn phytokeys bgci kew asia kewscience fairdata nature biodiversity conservation wildflowers botany ecologytwitter https t co cohgqavom,Publikation
216,don t forget to sign up for next week s tutorial on using nomad as an eln https t co hbbel tadp rdm eln fairdata,Veranstaltung
217,i m really proud of the fairdata dronemapping revolution we are building with geonadirau if you use drones or want to and care about the environment join me tomorrow for our roadmap webinar https t co b vfjcqyqe earthobservation remotesensing geospatial https t co gvqaimryvj,Veranstaltung
218,fair data station for lightweight metadata management and validation of omics studies fairdata metadatamanagement bioinformatics gigascience https t co bqwxsc cee,Publikation
219,make sure to hop on the next it i tech dive webinar join d blodgett mikemahoney guest speaker mike johnson from lynker intel on thurs march at pm et earthsciencedata interoperability fairdata co hosted w usgs cdi https t co zu ojaklfz,Veranstaltung
220,the agentproject train the trainer team teached trainer from partner institutions two days at leibnizipk focused on tooling data flows pipelining and standards for activating european genebanks for plant genetic resources contribution to fairdata elixireurope nfdi de https t co g k kta h,Veranstaltung
221,just published emily rayfield pamela gill lautenschlager et al functional reorganisation cranial skeleton https t co qormeqrz dataset fairdata nercscience uobearthscience https t co rlcgrgd qm,Publikation
222,just published controlled rachael gooberman hill andrew moore evaluating the implementation of the star care pathway an interview study https t co zzye ib gr dataset fairdata nihrresearch medicalbristol https t co h lejsg,Publikation
223,the cicompass fair findable accessible interoperable reusable data twg is conducting a survey to learn abt current practices needs of fair data implementations at nsf major facilities the survey closes on march access the survey https t co am ie o wn fairdata https t co pdzgrlj ro,Meinung
224,a short video about our brand new dataset search have a look and subscribe early https t co c dfznmzcn datasetsearch structureddata opendata mldata fairdata datascience,Meinung
225,we have a great assistant prof position in fair research data infrastructures come work with nice people on making nice data even nicer https t co wg uhqibjj fairdata datascience openscience,Meinung
226,registration closing soon the ddi variable cascade describing data to optimize reusability and comparison thu march online free https t co wtbz khq c codata fairdata openscience datascience opendata https t co sdobljamlr,Veranstaltung
227,newspecies new squat lobster from pacific ocean just flushed in heteronida ceres holotype le museum treatment https t co xfwfpmtl publication https t co dceswwyt s ejtaxonomy crustaceansoci crabday aqualuvsuotd fairdata nature biodiversity conservation https t co mvkttnbhu,Publikation
228,excited to be joining the data spaces symposium come visit us at our fairdataspaces exhibitor booth and learn how we connect industry and science fairdata dataspaces,Veranstaltung
229,it is encouraged that intellectual assets are managed in a way to enable openscience open innovation openaccess fairdata euresearcharea valorisation https t co jpt ubmu c,Meinung
230,iwd ilarosat martinapulieri cristinadimuri follow fairimpact eu quote retweet this post tagging a colleague embraceequity fairdata eosc https t co q shpshwa,Veranstaltung
231,watch on demand experts sharing experiences and exploring solutions to common barriers in fairdata openscience catch up here https t co qcpkpf tsb researcher machinelearning keeeto kylecranmer megaparsec keirsd https t co rmaf dg l,Veranstaltung
