,Clean_Content,Kategorisierung
1,wilhwid bbmrieric ilireh ecrin eric tugraz gate coe eoscfuture ni os eu eoscportal vetenskapsradet stockholm uni the austrian openscience policy incentivises the adoption of os practices defines indicators for its implementation establishes links to eosc and also covers fairdata research integrity skills and education and citizenscience ilireh tugraz eosctripartite https t co lpwmoubkmf,Meinung 
2,i spent this morning with eerorinne and the students of agf unisvalbard it was great to see what data they have been collecting this term the data will be published in netcdf files fairdata,Veranstaltung
3,the first panel at today s eosctripartite event in bulgaria focuses on infrastructures in support of openscience and fairdata maximising the benefits of researchdata with guests from key ris and eosc related initiatives full programme https t co boflqaqsll https t co boq ngil,Veranstaltung
4,that s right we will provide financial support to individuals organisations aiming to develop fairdata implementation tools approaches read our faqs to learn about the opencalls that will be launched between and check the link https t co cuptqq td https t co qxmsa pqw,Initiative
5,the first main recommendation from the studying on scientific impact of research infrastructure traceability of results on the top of it are pids kswd konsortswd researchdata persistentidentifiers rdm fdm fairdata berlin ratswd nfdi de https t co npefapxw o,Veranstaltung_Publikation
6,today free metacell webinar mar pm edt for researchers looking for innovative ways to set up execute their life science data analyses in a collaborative extensible open source cloud environment register here https t co hrhhh qcu fair fairdata https t co sr ofumd,Veranstaltung
7,come and visit us and daphne nfdi at our booth today tomorrow and thursday booth h in the hsz dpg nfdi fairdata https t co rzuhlebsg,Veranstaltung
8,eosc is an overarching system that supports research and innovation through serviced access to fairdata the focus of eosc is to become a public good read the opinion paper https t co csrxcjgflu https t co ctovuih zp,Publikation
9,eosc steering board for italy giorgio rossi presents the key policy issues identified by the eosc for dataliteracy eosc and the private sector eosc sovereignty on fairdata these brought to a series of opinion papers which you can find in the following links https t co obu wizvgo,Veranstaltung
10,workshop the worldfair project s cross domain interoperability framework march slides and recording now available https t co dfbr ynlvh codata fairdata openscience datascience opendata https t co dsohkfczgh,Veranstaltung
11,newspecies new bush cricket from brazil just crawled in listroscelis cyanotibiatus treatment https t co qmyd hazw publication https t co e puolxnhu zootaxa insect otd cse at fsca royentsoc orthopterach fairdata nature biodiversity conservation entomology https t co opnz oy hw,Publikation
12,making your data findable accessible interoperable reusable fair can significantly increase the impact of your research and gain more citations for your datasets to help you achieve fairness we put together a wide range of fairdata resources https t co l fnxlyip,Initiative
13,fairchemistry worldfairp iupac thank you leah and everybody at the iupac committee on publications and cheminformatics data standards and fairchemistry for everything you do to make all chemical data fairer worldfairp codatanews resdatall fairdata acsspring,Meinung 
14,tomorrow free metacell webinar mar pm edt for researchers looking for innovative ways to set up execute their life science data analyses in a collaborative extensible open source cloud environment register here https t co hrhhh y fair fairdata https t co zozsqjbun,Veranstaltung
15,sciebo rds a key cs mesh eosc technology simplifies research datamanagement promotes fairdata principles integrated with sciencemesh it enables direct data export from efss systems to data repositories like zenodo org learn more https t co tyywmr ibm https t co oiqnwhc x,Initiative
16,sarapittonet trustitservices presents the fair impact grants platform where repositories researchinfrastructures datamanagers can apply to have our support in improving datafairness using rocrate metadata learn about our fairdata opencalls https t co visxyszhzo https t co ynciugnmd,Initiative
17,at fair impact webinar soilandreyes conservancy explains the scope of support offer enabling fair signposting rocrate for content metadata discovery consumption apply to have our help in embrancing fairdata learn more here https t co gwnqydcige openscience https t co if x hgo,Veranstaltung
18,fair impact webinar opencalls for financial support being launched this april to help embrance fairdata practices jonquet lirmm inrae france provides an overview of the offer fairness assessment challenge for datasets semantic artefacts https t co visxyszhzo https t co melbt e vt,Veranstaltung
19,check out the new changes of how the gwascatalog will be distributing summary statistics https t co jx iosuhnd new metadata and formats to make sumstats fairdata and improve utility in other applications like polygenic scores https t co goq zqt g,Initiative
20,visit our booth hsz h at dpg to see live demos on nomad and fairdata for materialsscience https t co fzc olnrp,Veranstaltung
21,the th kswd conference is just starting what an exciting meeting boosting the interaction between science politics media and society to create a new data culture in germany kswd konsortswd researchdata persistentidentifiers rdm fdm fairdata berlin ratswd nfdi de https t co lsbg xzh c,Veranstaltung
22,can molecules be described by a barcode check out here to listen how molbar can make chemical database better fairdata nfdi de digitalchemistry,Veranstaltung
23,reminder stammtisch march with nils van staalduinen jun prof christoph bannwarth talking about molbar a new form of molecular representation details registration req https t co qbvravieqt infrastructure data research fairdata chemistry chemtwitter https t co z gjx g,Veranstaltung
24,i will be at dpgspringmeeting this week in dresden representing fairmat nfdi visit our booth to learn more about fairdata management our tools and infrastructure and the rdm training and education opportunities that we offer,Veranstaltung
25,at dassh we provide the tools and services for the long term curation management preservation and publication of marine species and habitats data we are committed to the fair findable accessible interoperable and reusable data principles fairdata mbadata https t co nn dfdkbkn,Initiative
26,fairmat s area f is driving adoption of fairdata management in the scientific community through community engagement training and outreach we ensure that our tools and infrastructure meet the needs of researchers join us at dpg dpgfr hjahrstagung to learn more https t co cuzohqaajh,Veranstaltung
27,nomad is empowering the materials science community area e are creating use cases to demonstrate how the tools developed by fairmat support the research of various sub communities join our experts at dpg dpgfr hjahrstagung to learn more fairdata https t co slws arz,Veranstaltung
28,fairmat area d lays the foundation of a federated research data infrastructure for the condensed matter and chemical physics community join our experts from area d at dpg dpgfr hjahrstagung fairdata https t co tcnstjsyrp,Veranstaltung
29,we are enhancing nomad infrastructure and services by adding recent ab initio advancements classical simulations multiscale modeling and excited states methodology learn more from our experts from area c at dpg dpgfr hjahrstagung fairdata https t co xhsrcvitei,Veranstaltung
30,attention solidstatephysics and physicalchemistry researchers we re revolutionizing rdm by creating a complete cycle through fair concepts join our experts from area b at dpg dpgfr hjahrstagung to discover how we re building a comprehensive rdm system fairdata https t co reeolowbp,Veranstaltung
31,unlock the secret to reproducible sample synthesis with fair datamanagement our speakers from area a will reveal how we re identifying hidden synthesis parameters devising synthesis recipes and making characterization data accessible dpg dpgfr hjahrstagung fairdata https t co quz noder,Veranstaltung
32,join us on thursday for a topical talk by our deputy spokesperson prof christoph t koch humboldtuni and discover how fairmat is working to make fair data management a reality fairdata dpg dpgfr hjahrstagung https t co sibx h si,Veranstaltung
33,a recording of a recent presentation how to publish unisvalbard data which data centres file types conventions how to publish fairdata https t co nq maln t https t co w iui nbu,Veranstaltung
34,newspecies new land snail from china just crawled in laeocathaica qishilii treatment https t co kgayo eod publication https t co effiliby f zookeys journal malacsoc malacologica ams femoraleshells fairdata biodiversity conservation malacology snails https t co plisildtp,Publikation
35,tomorrow free metacell webinar mar pm edt for researchers looking for innovative ways to set up execute their life science data analyses in a collaborative extensible open source cloud environment register here https t co hrhhh y fair fairdata,Veranstaltung
36,newspecies new jewel beetle from the china just flew in anthaxia svatoplukbilyi treatment https t co dkrifgokj publication https t co ov sgjqddn zookeys journal entomologyart coleopsoc entcollnet nmnh entomology fairdata biodiversity conservation insects https t co p kvhzs,Publikation
37,such exciting news the netherlands is an exciting and inspiring place to be for openscience adding martateperek jeroenson will make the nwonieuws dept an unstoppable dream team can t wait to see what you all achieve researchfunder eosc fairdata watchthisspace,Meinung 
38,newspecies costus whiskeycola a newly discovered plant from colombia not named after a drink but after its type locality el whiskey with cola latin for living in treatment https t co h ltkccip publication https t co fmxrsyd q phytotaxa flora incognita fairdata https t co fcwceaczpu,Publikation
39,and who has missed the workshop on research data management at the cdt this year can find the slides here https t co cmixnlyfok fairdata for chemistry chemtwitter nfdi chem thank you to pascal,Veranstaltung
40,behind every great structure there s a great big data set too iucrdata are now publishing rawdataletters to promote findable accessible interoperable and reusable openaccess fairdata read more at https t co u h ufnlnq and https t co ntitcusjey https t co shkzkxitk,Publikation
41,learn about new openaccess immunology data and resources to support your research and keep up with the research community through immportdb s quarterly newsletter stay in touch register here today https t co iu udb ijn datasharing openscience dyk fairdata data https t co lcripiwqpl,Initiative
42,newspecies new moray eel from india just swam in on fishfriday gymnothorax tamilnaduensis treatment https t co whga grfnz publication https t co pi x hpmdm zoosyst evo wrmarinespecies fishbaseproject fishinthenews fairdata nature biodiversity conservation fish https t co o exm lc,Publikation
43,example data structures in cdi wide long multi dimensional and key value cdi facilitates programatic transformation of data structures which is very useful for data integration ddialliance codatanews worldfairp fair fairdata interoperability openscience https t co lbx wdd,Meinung
44,newspecies new fly from the lower eocene of colorado usa just surfaced on fossilfriday eornithoica grimaldii treatment https t co fdyjqnmomo publication https t co gza pv ia palaeoentomology paleodb paleosoc paleosynth fairdata biodiversity paleo insects https t co p uzjhxx,Publikation
45,our th nfdi section industry engagement section industry is starting the goal of the section is to coordinate cooperation with industry and thereby create more value for society more https t co jkizhnck fdm rdm fairdata https t co rzywfbcbv,Meinung
46,suis je le seul gal rer pour expliquer clairement en quoi consistent les principes fairdata pour les donn es moi je dis findable doi et m tadonn es accessible dans un entrep t interoperable formats ouverts reusable licence ouverte comment faites vous https t co aip mmefna,Meinung
47,publication alert our paper on the fair data station is out now fairdata fairdatastation fairdataplatform unlock unlockmicrobialpotential by a o jjkoehorst,Publikation
48,moraneottilia swheritage is at rdaplenary gothenburg fairimpact faircore eosc workshop on metadata for fairdata its important for datamanagers to become familiar with software shcemes on metadata know tools to help create metadata joins us https t co quk siaokd https t co lvxctwpvin,Veranstaltung
49,schon mal von den nfdi tooltalks geh rt diese finden regelm ig online statt und werden auf youtube aufgezeichnet im letzten tooltalk stand die fdm plattform coscine im rampenlicht https t co d fcqpr dk fdmrwth fairdata rdm https t co hid qkgz,Veranstaltung
50,moraneottilia swheritage is at rdaplenary gothenburg fairimpact faircore eosc workshop on metadata for fairdata its important for datamanagers to become familiar with software shcemes on metadata know tools to help create metadata joins us https t co quk siaokd https t co v bwcvvgw,Veranstaltung
51,a global approach for natural history museum collections leafdoctor how can you talk fairdata and publish closed access would be helpful to get openaccess to your important article https t co hpdwentoij biodiverstiy,Meinung
52,retrieved data is not identical in content structure which lowers its quality usability trust join us for an open discussion today at pm eet valexiev will demonstrate how bsdddata can go full fairdata https t co tficd zg c https t co nfdnwoqt j,Veranstaltung
53,what is a research data management plan why should i have to write one how does it benefit me you can find out in our new guide to writing a dmp https t co rfgodhgyqm rdm fdm datamanagement fairdata,Meinung
54,newspecies a newly discovered fungus from mexico for fungifriday pseudoboletus silvaticus treatment https t co u fcyi jyn publication https t co iidyb ygee phytotaxa kewmycology allthingsfungi mycofun globalfungi fairdata nature conservation fungi mushrooms https t co js dvfjppi,Publikation
55,today fabian has presented recent results from our lab entitled integrating digitalization and research data management rdm into the curricula of bachelor and master students in chemistry at the smuk dpg spring meeting in dresden nfdi chem nfdi de fairdata https t co p dfctgyq,Veranstaltung
56,happy world meteorological day worldmetday fairdata fairnesscost https t co bzrm qm j,Meinung
57,interested in fairdata practices curious about openly sharing data from publicly funded clinicaltrials join ilsi s focus area on dataaccess datasharing for food and nutrition trials https t co wgbgzghcxj nationalnutritionmonth nutritionmonth research https t co eldfjs yn,Veranstaltung
58,such a great initiative a new online home for otherwise homeless atmospheric data across the disciplines including airborne data from moving platforms surface data on greenhouse gases and data on reactive trace gases cloud and aerosol particles fairdata eufunded,Initiative
59,we are happy that the data collected in phenobs can now easily be accessed by other people from the wide field of phenological research fairdata phenology research,Meinung
60,with l informatics we ve joined forces to provide the ontology backed data unification solution to unlock your data s true potential read more in our latest blog on how together we can streamline your scientific workflows https t co h yozq vp fairdata lifesciences centree,Meinung
61,the common fund is seeking applications to funding opportunitites regarding diversity fairdata cloudcomputing and biomedicalresearch that make use of publicly available data resources check out the current opportunities https t co qflcsegjyn https t co qbsx msrh,Initiative
62,join us this afternoon at cet for the parc chemicals friends webinar series on fairdata fairtools where today we hear from pennynymark on her experiences of re using data find the zoom link at https t co g de gxc see u there worldfairp inquire eu eunanosafety,Veranstaltung
63,happening next week free webinar for researchers looking for innovative ways to set up and execute their life science data analyses in a collaborative extensible open source cloud environment openscience opendata fair fairdata,Veranstaltung
64,want to know more about katrinmoller s experience sharing data on the emblebi bioimagea join us on tuesday march pm cest for the eurobioimaging guide to fair bioimage data online workshop she ll tell all microglia fairdata more https t co ubgwt qvh,Veranstaltung
65,from our discussions fragmentscreen meeting clear pilot cases with researchers data obtained at research infrastructures kept at eosc can be crucial to ensure fairdata let s make it happen instructhub robbie joosten cnb csic jm carazo eoscfuture eosc synergy eosclife,Meinung
66,andy g tz the coordinator of panosc for esrf looks at fair data an initiative to deliver research data to the scientific community to use andy gotz fairdata https t co qnealwgrdt,Meinung
67,ing grid took part in the rdaplenary this tuesday with a presentation about the journal concept in a joint meeting you can watch the presentation here https t co r cyszmr d resdatall fairdata rdm researchdatamanagement engineeringsciences openpeerreview,Veranstaltung
68,now ludwighuelk data manager open science unit rl institut on the achievements and challenges of the openmod initiative openscience opensource openmod ludwig shared insights into fairdata sharing principles yesterday in the capacity building more info https t co pvr emmtpy,Veranstaltung
69,hydros peter van der keur is at the un waterconference side event here he will represent eurogeosurveys as a panelist and stress benefits of fairdata and sustainablenaturalresources management tools for supporting transformative policies for integrated solutions for gw https t co thnbpjg r,Veranstaltung
70,a minute video demonstrating why data published to zenodo org are not fairdata https t co ou x raik when deciding where to publish your data test how easy it is to find data extract from a recent nansenlegacy webinar sios kc unisvalbard https t co l ebfq toq,Meinung
71,an introductory video on how nansenlegacy data should be published from tuesday s webinar project members please watch if you weren t able to attend also if you re not in the project and want to learn about publishing fairdata https t co rooc qasv https t co he bdwkak,Veranstaltung
72,along with some great lessons in taking a user focused approach to fair implementation fairdata https t co yubt hkwnf,Veranstaltung
73,we have been working on improving our data management to ensure fairdata of the results obtained by the use of our facilities thank you to the eu commission for their support with horizoneu projects to address this important issue,Meinung
74,also today jm carazo cnb csic instructhub spain presenting at the international symposium on grids and clouds instruct works towards data integration to ensure fairdata through our work with the eoscassociation in particular with projects eosc synergy eoscfuture eosclife https t co nnzgtmzcb,Veranstaltung
75,dr peter bellstedt in action logs in the academic measuring sector at the university jena at conference practical problems of nuclear magnetic resonance on science campus buch berlin eln lims sdms datarepository scientificdata fairdata https t co diqhvqqszj,Veranstaltung
76,newspecies new freshwater sleeper from china just snored microdous amblyrhynchos treatment https t co gdrhfle r publication https t co g itx rjv zookeys journal neotropi ichsandherps fairdata nature biodiversity conservation science fish teamfish sleeper https t co xoneou tot,Publikation
77,fair island real world examples of place based open science fairdata openscience gigascience https t co dlcatdewjf,Publikation
78,pnnlab team in attendance at the resdatall rdaplenary great to see both ssherid and julianes here representing doescience and fairdata community working group efforts https t co jodqrfimaw,Veranstaltung
79,happy worldwaterday what s your favorite earthsciencedata tool dataset or resource water hydrology cleanwater fairdata https t co m b izet,Meinung
80,uspechyfit ve sv t je obrovsk mno stv nevyu it ch dat z v zkum v dci z fit vut v ele s robertpergl vyvinuli n stroj dswizard org kter pom e s pl nov n m jejich efektivn ho zpracov n https t co tx ia qdbq fairdata findable accessible interoperable reusable https t co ywxufbgiwr,Initiative
81,our team member will be part of elsevier s webinar on rdm is a team sport not a single player mission discussing the future of researchdatamanagement fairdata opendata and eosc tune in tomorrow thursday rd march at pm cet https t co gze hyvpuu openscience,Veranstaltung
82,just finished big talks in days about publishing nansenlegacy data and unisvalbard data thanks to those who attended the recordings will be circulated soon fairdata,Veranstaltung
83,i d rather predict a fairdata future,Meinung
84,join the discussion on the future of fairdata opendata and eosc in our elsevierconnect webinar on rdm is a team sport not a single player mission on thursday march at cet registration https t co ctknifedbt openscience https t co dxngjerzlj,Veranstaltung
85,and what s our vision ai technology in combination with opendata and fairdata can help to identify stressors of waterquality in order to produce science informed decisions that improve lakes management,Meinung
86,to achieve datainteroperability fairdata datamanagers repositories need to care about semanticartifacts with their growing number diversified uses interconnecting them becomes critical join us april to learn more improve your dataskills https t co omrwmlsqfu https t co j ai nbtit,Veranstaltung
87,there are still many barriers preventing fairdata and openscience in publishing watch our expert panel discuss how these barriers can be overcome https t co yraxvtvrt machinelearning keeeto kylecranmer megaparsec keirsd https t co bxqi dr cq,Veranstaltung
88,newdataset k occurrences from dutch coast monitoring k birds bivalvia polychaeta length biomass count sampling fairdata available via https t co pao eow d jmeesvliz vliznews emodnet biology lifewatchvliz obisnetwork marinescience openscience https t co l sepnp af,Initiative
89,and in a parallel capacitybuilding session ludwighuelk rl institut is presenting best practice approaches for opensource annotated fairdata with the openenergyplatform oep fairdata for openscience openmod https t co rds ismfrz,Veranstaltung
90,at okmaps we don t simply provide new services because we can but because we care how do we know what researchers need this gofairofficial discovery in crowdsourcing we coordinated provided some great insight discover data discoverability with us fairdata openscience,Initiative
91,nice to see some of the research data networking efforts in norway being highlighted at rdaplenary fairdata opendata openscience thanks to debsethorpe aoife coffey for bringing us together to discuss synergies,Veranstaltung
92,this move by the publisher continues its commitment to open science by supporting open research practices across all research outputs and our course our scientificdata journal was already ahead of the curve rdaplenary opendata openresearch fairdata,Meinung
93,opidor rdaplenary resdatall madmp datacite inist cnrs ouvrirlascience dmp fairdata https t co ikvbp z o,Veranstaltung
94,pids are needed to make datasets machine readable rebecca grant f research rdaplenary fairdata https t co xkvss gcfr,Meinung
95,dr sina kazemi scientific lead developer for the logs platform giving a great talk on reasearch data management aspects at conference practical problems of nuclear magnetic resonance on science campus buch berlin eln lims sdms datarepository scientificdata fairdata https t co zj e q ezi,Veranstaltung
96,newspecies new special skaters from laos just skated in eotrechus kerberos holotype nhm wien treatment https t co napb nozoe publication https t co cspy xomq dez journal pensoft entomologyart royentsoc fairdata nature biodiversity conservation insects https t co k d hy xi,Publikation
97,sndsweden fairdata t nker ni inte fel att bara fokusera p output skall man jobba datadrivet s m ste ni f nga krav och user cases se min skuggbacklog https t co avdnobyktp cc astrom iko karingronvall kultursilos digitalsilos,Meinung
98,the dataspacessymposium supports biodiversity with a giveaway to its presenters among the presenters nikolaus glombiewski uni mr and nfdi biodiv showing geospatial data about biodiversity in one of our three demonstrators nfdi gaiax fairdata https t co gtv fhvwmt,Veranstaltung
99,my overview of faircookbook https t co icj hefrt part of elixireurope practical recipes with real examples on various data types to make fairdata use it join it adopt it as already done by horizoneu health programme pre print at https t co oru milel rdaplenary https t co ax s leaot,Publikation
100,and sgregurick nihdatascience on results of survey of operators of infrastructures that support lifescience digital asset management to ascertain which aspects of the research data lifecycle each support how mature these resources are to enable fairdata rdaplenary https t co bbrm la p,Veranstaltung
101,the rdaplenary lifescience researchpractice ig is on agenda notes and link to all slides at https t co lnuxh thnr jeff christiansen kick off the event fairdata elixireurope nihdatascience https t co ydfbad frh,Veranstaltung
