,Clean_Content,Kategorisierung
102,looking forward to meeting the dataverseorg community f f at dataverse uminho oficial in june opendata fairdata openscience opensource research infrastructure,Veranstaltung
103,dri is one of many resdatall national nodes linked to organisations in so many other countries doing the same work to support openscience and fairdata so nice to see these links at rdaplenary,Veranstaltung
104,our nfdi director ysurevetter is also chair of the high level advisory commitee of fairimpact eu fair impact supports the implementation of fair enabling practices tools and services across scientific communities with the goal to realise an eosc of fairdata and services,Initiative
105,rdaplenary n simons ardc au gives an overview of the shifts in the research landscape years ago data sharing was still a challenge today we have a community organized around fairdata and we are pushing researchsoftware as a firs class object https t co isgggsibvt,Veranstaltung
106,scilifelab dc team are happy to participate in rdaplenary this week in gothenburg come talk to us snd rda europe datamanagement data fairdata fair points https t co b vbq x if,Veranstaltung
107,el portal de datosabiertos de europarl en recoge conjuntos de datos en idiomas sobre el trabajo parlamentario de la ue un contenido interoperable que se puede compartir y reutilizar libremente fairdata euopendata https t co gcvkcyo yj,Initiative
108,newspecies aspidistra shiwandashanensis a newly discovered asparagaceae from china treatment https t co szrham jtu publication https t co rtm rbs phytotaxa bgci kew asia love plants botany globalseedvault flora incognita fairdata nature conservation https t co k xvjsg,Publikation
109,do you manage research data at your university or institution download australia s new research data management framework for institutions including reusable resources to uplift rdm at your institution https t co zgjq cgj fairdata researchdata guide,Initiative
110,explore the data set on the enable platform now https t co xqjgva lcj datasharing fairdata https t co z hzf xv,Dataset
111,tomorrow is the last day to apply for the bioitworld hackathon which will bring together innovative datascientists developers from across the industry to solve real world datachallenges using the principles of opensource fairdata bioitworld https t co yshdwtn hy,Veranstaltung
112,vanavond te gast bij provincie antwerpen waar er aandacht is voor preventie en healthliteracy bij symposium van umca uantwerpen daar mogen we vanuit voka hc niet ontbreken fairdata impact https t co cekmdsqsf,Veranstaltung
113,apply now the codata rda research data science south africa deadline march https t co pomw bmcec codata fairdata openscience datascience opendata https t co gt dubenpz,Veranstaltung
114,what are the current areas of focus for cdif principles web architectures technologies discoverability data access semantic interoperability structural interoperability universals geography uom time worldfair fairdata opendata,Meinung
115,exciting news we ve joined forces with scibite to provide the ontology backed data unification solution you need to unlock your data s true potential check out our latest blog to discover how we can streamline your scientific workflows https t co opsf i s fairdata https t co whraiukbon,Meinung
116,cdif is looking at recommendations around practice across standards want to learn more visit https t co qes onzpli worldfair fairdata https t co fuasfxcvl,Meinung
117,arofan gregory on the vision for cdif its role as a cross domain lingua franca fairdata opendata worldfair https t co xfdhstaxfq,Veranstaltung
118,what is our experience with fips so far in worldfair check out our report https t co zjqd g i fairdata opendata,Meinung
119,worldfair includes a fascinating range of case studies therefore offers insight into how data works within these domains what we need to do to ensure data is interoperable reusable find out more about the case studies https t co jhob f ndo fairdata opendata https t co bj azkxkts,Publikation
120,an introduction to worldfair its wide range of authoritative global partners and the richness of work packages in the project find out more about the project https t co yl ei fxpt fairdata opendata openscience https t co pbcvr v x,Initiative
121,contributions by fairsharingcommunitychampions and bicikl h partners enabled development of a fairsharing org powered web app that reveals links between organizations implementing biodiversity related fairdata standards databases and policies https t co knyu ll ht https t co ujxirrlv o,Initiative
122,international training workshop on open science and sdgs https t co zgoncwkf z codata fairdata openscience datascience opendata https t co dvmnuz pak,Veranstaltung
123,just published as controlled data joanna kesten react study https t co oofpioocao dataset fairdata esrc brms research https t co kqje ctdx,Dataset
124,learn more about the rdm platform coscine in today s nfdi tooltalk at pm fdm fairdata rwth,Veranstaltung
125,how to use ausgeochem https t co sqwolqs o sample selection tool ausgeochem auscope geology auscope fairdata geochemistry https t co ccvm fxna,Initiative
126,newspecies new micro land snails from thailand just crawled in e g diplommatina bulonensis treatment https t co ivufjbmixv publication https t co cbrxxgs tc zoosyst evo malacsoc malacologica ams femoraleshells dailysnailies fairdata biodiversity snails https t co nojqi tcc,Publikation
127,reminder chemotion eln hands on interested in an interactive workshop on using chemotion eln you re in the right place we introduce chemotion its features for beginners with a learning by doing concept https t co qjaj v wvw fairdata chemistry chemie chemt https t co zx l ncuem,Veranstaltung
128,newspecies new pilumnid crab from pacific ocean just surfaced lophoplax sordida holotype mzb treatment https t co udh f thq publication https t co wiulkechqm zootaxa crustaceansoci crabday aqualuvsuotd fairdata nature biodiversity conservation crabs https t co a x kkd c,Publikation
129,addressing barriers in fair data practices for biomedical data fairdata biomedicaldata scientificdata https t co nzjthfemrg,Publikation
130,sensemolen j jobst physrevmater it s graphene triangles stripes singularities and spirals all in a single system other applicable buzzwords electronmicroscopy domainwalls phasetransition symmetrybreaking opendata opensoftware fairdata,Publikation
131,happy to share that the pre print of our article opportunities for improving data sharing and fair data practices to advance global mental health is now available online https t co mk u v egs nancyka global trauma fairdata,Publikation
132,nature doesn t care for political borders fairdata facilitates international cooperation cross border nature conservation research our role providing technical solutions https t co nwdkosts j snsb aktuell nationalparkbayerischerwald charlesuniprg,Publikation
133,let openscience start in your own research group with transparent annotations for projects data versions and code and with the utilization of standards that make fairdata and collaborations easier bioinformatics datascience academictwitter rstats ai dataanalytics,Meinung
134,did you know that also data can and should be recycled today on globalrecyclingday we d like to show you some great publications from our community that were created thanks to reusable data fairdata biodiversity biodiversitydata https t co d wc gydk,Veranstaltung
135,newspecies new cicada from the philippines just flew in neopurana bouptera treatment https t co tzlngbsnqy publication https t co y d p a ac journalofnaturalhistory tandfonline entomologyart cicadamania fairdata nature biodiversity conservation insects https t co indqeqclnw,Publikation
136,newspecies a newly discovered fungus from china for fungifriday geastrum suae treatment https t co dai fvmh i publication https t co tvachfiiwv biodatajournal kewmycology allthingsfungi mycofun globalfungi fairdata nature conservation fungi mushrooms https t co ugljbe ydp,Publikation
137,biodt vacancy at nhmoslo science as datascientist on biodiversity information standards tdwg for the horizoneu project biodiversity digitaltwin deadline jobopportunity https t co vupfek xpr openscience fairdata biodiversityinformatics https t co hggwheccuk,Initiative
138,newspecies new goby from the red sea just swam in fusigobius humerosus treatment https t co jyu tay ek publication https t co imwzxbj zootaxa ichsandherps fishbaseproject fishinthenews fairdata nature biodiversity conservation science fish teamfish gobies https t co vssavksbzp,Publikation
139,towards improved findability of energy research software by introducing a metadata based registry is also recently available for open peer review all the community is invited to take part read and comment here https t co pwpqjrxltb rdm researchdatamanagement fairdata,Publikation
140,this june th nd we are hosting a conference where scientists can connect on the theme of long term experiments bsw scienceweekuk lte fairdata science connections lte rothamsted https t co bwdiatqdnc of https t co tf uuvmcpo,Veranstaltung
141,we are part of glten the global long term experiment network which connects long term experiments with one another ltes and scientists from around the world bsw scienceweekuk lte fairdata science connections lte rothamsted glten agglten of https t co u yefai dh,Veranstaltung
142,we are connecting scientists across the world with data from the rothamsted long term experiments bsw scienceweekuk lte fairdata science connections lte rothamsted of https t co w eioczek,Veranstaltung
143,british science week is all about connections we are connecting the past to the present by making the historical data from our long term experiments available to all bsw scienceweekuk lte fairdata connections lte broadbalk rothamsted f https t co agcmmlcgh,Veranstaltung
144,happy st patrick s day to celebrate why not dip into the irish sea using our dassh mapper tool and discover different species and biotopes https t co ifmtrf nhp stpatricksday data dassh fairdata marineconservation https t co orgu ru b,Initiative
145,newspecies new terrestrial breeding frog from peru just hopped by on frogfriday phrynopus apumantarum holotype corbidi treatment https t co mdixbdweru publication https t co ac nj yvqv zootaxa herphighlights amphibiansorg frogsandsuch parcorg fairdata nature https t co hex dqroro,Publikation
146,if you want to learn more about how to contribute to biolitrepo by liberating data from the pdfprison there are further training courses to be announced on https t co bcgu ftrr and see eg https t co pynpfre openaccess fairdata biodiversity,Veranstaltung
147,the session recording is here dr mark rattenbury geologist and programme leader gnsscience spoke about using the ardc fairdata self assessment tool to evaluate high value geoscience datasets watch now https t co e jvftqdot dataquality,Veranstaltung
148,fair data station for lightweight metadata management and validation of omics studies fairdata omicsstudies gigascience https t co bqwxsc cee,Publikation
149,the fairdata mountain is a steep climb my scibite colleagues provide tooling and domain expertise to help as evidenced by the introduction of this new workbench tool check it out nothing ventured nothing gained right https t co c x h xpba,Initiative
150,fairdata sharing https t co kdkuyhbawv,Meinung
151,dknet summer of data student program join a week virtual summerprogram that teaches sciencestudents datamanagement fairdata rigor reproducibility skills while performing research within their labs stipend apply by https t co ipq hnn m https t co kbn kgfn,Veranstaltung
152,immportdb is honored to be a coretrustseal data repository and support fairdata keep up with the research community and find data on diseases including covid to support your research today registration is quick and free here https t co unsa cjj p openscience https t co jo ac kl,Initiative
153,today at pm et join the nih radx datahub partners for a presentation of metadata in the radxdatahub including a discussion of methods to create datamodels dataharmonization strategies fairdata best practices bigdata nihdatascience https t co td cuap pw,Veranstaltung
154,the nihendaddiction datastewardship group is hosting its next webinar on today at pm et highlighting important takeaways lessons learned from previous fresh fair webinars followed by a live q a nihhealinitiative nih fairdata register today https t co j n wjxt,Veranstaltung
155,miten s ilytt digitaalista tutkimusaineistoa jonka olemassaolo itsess n on jo merkitt v blogikirjoitus tutkimusaineistojen pitk aikaiss ilytyksest https t co xaybh eqo dpres fi cscfi fairdata preservation pas https t co qcefgc ziy,Meinung
156,newdataset k occurrences from ports in latvia k taxa bacillariophyceae dinophyceae fish abundance count life stage fairdata available via https t co xe fq w x jmeesvliz vliznews emodnet biology lifewatchvliz obisnetwork marinescience openscience https t co svujsrcd k,Dataset
157,thanks to everyone who joined our tutorial yesterday on using nomad as an eln for fairdata to catch up or revisit it you can find the materials for this and all our other tutorials at https t co fwfxrgciyq,Veranstaltung
158,programme published towards a fairer world symposium at unesco paris and virtual march https t co q uyd oieq codata fairdata openscience datascience opendata https t co cl ecyambe,Veranstaltung
159,for data journalists fact checkers and developers europarl en s open data portal a single point of access to opendata about parliamentary work in languages that can be freely shared and re used https t co nbcfdaqdwe euopendata fairdata https t co xfk wrqmcy,Initiative
160,today we are having fun at the denbioffice spring school learning about research data management with jeanne wilbrandt and the best video about rdm fairdata https t co gl rfcyvlu,Veranstaltung
161,newspecies new grasshopper from crete just clittered eupholidoptera francisae treatment https t co v n r oizn publication https t co nn ye alz zookeys journal insect otd cse at fsca orthopterach balkanortoptera fairdata nature biodiversity conservation https t co dpkiiwg la,Publikation
162,hyloscirtus tolkieni collected in at the r o negro described and published in zookeys journal in treatment added to treatmentbank https t co fmv w yyc and mediated to gbif by plazi ch this process can be automated if the data is published as fairdata https t co gfrktynqi,Publikation
163,tagung praktische probleme der kernresonanzspektroskopie https t co ojuxkgki j logs eln das eln mit direktem spektrometeranschluss dr sina kazemi und python kann es auch eln lims sdms datarepository scientificdata fairdata https t co abpv il,Veranstaltung
164,vacancy nhmoslo science as datascientist on biodiversityinformationstandards tdwg for the horizoneu biodiversity digital twin biodiversitydt deadline rd april https t co pbvr yykm jobopportunity openscience fairdata digitaltwins biodiversityinformatics https t co pfl znrdc,Job
165,don t miss the new day event and see fairdatasociety graduate from ethswarm expect some really cool panels and demos too ethereum fairdata,Veranstaltung
166,sharkcat loves learning about semantic data errantscience profechem stuchalk njkknight semanticweb fairdata python pythontraining https t co qxejlrxaza,Veranstaltung
167,register now statistical agencies using ddi metadata standards promoting transparency and reusability of data online april https t co mzi wetidx codata fairdata openscience datascience opendata https t co krcxmmryak,Veranstaltung
168,last day to apply for defragmentation ts bringing bioimage analysts to the cloud trainingschool bioimageanalysis fairdata cloudcomputing ai life workflows benchmarking eosclife neubias cost apply now https t co ewe xvmr q,Veranstaltung
169,thank you for inviting the scilifelab dc portal team to present data sharing on the pandemic preparedness portal lessons learned on today s workshop enlight eu uu university fairdata covid scilifelab kawstiftelsen emblebi https t co gecejgxg c,Veranstaltung
170,hey did you register for the workshop on metadata curation for researchsoftware taking place next week during the rdaplenary join us faircore eosc in to learn how to improve digitalresearch through more fairdata software https t co bcstdgr fm https t co ylet zlmm,Veranstaltung
171,just published alberto pirrera rainer maria groh jiajia shen ed wheatcroft mark schenk data for publication structural function from sequential interacting elastic instabilities https t co exe zts dataset fairdata epsrc bristolunieng https t co k zb qpys,Publikation
172,just published controlled natalia lewis gene feder michael lawton alison gregory alice malpass brc comfort study https t co qr w mky u dataset fairdata brms research brishealthsci https t co krvgz rza,Publikation
173,newspecies new fossil turtle from colombia just emerged podocnemis tatacoensis holotype mhn la tatacoa treatment https t co hedk ps wc publication https t co usudtsckwb geodiversitas le museum publi mnhn paleosoc herphighlights fairdata nature biodiversity https t co jpyqxbijto,Publikation
174,i posted a blog with my colleagues today and it s about of course chatgpt and the crucial role of making our research outputs openaccess and fairdata to make it better https t co gscj zxgc,Meinung
175,researchimpact researchandinnovation visibilitymatters openaccess openscience openresearch opendata fairdata sharing chioma blaise chikeredr to the world https t co fn wq qc,Meinung
176,the distributed systems of scientific collections disscoeu aims to digitally unify all european natural science assets under common access curation policies and practices that ensure fairdata nielsraes from museumnaturalis presents https t co uvfupigvyq eu ris https t co ixnvwntyi,Veranstaltung
177,immportdb s latest webinar is now available learn more about selecting immport for openaccess immunological data sharing tools and resources for data management and sharing plan creation access the webinar recording here https t co jh tbra h fairdata opendata https t co dvq dsdove,Veranstaltung
178,the brand new nomad website is now live check out its new sections featuring solutions tutorials and support channels perfect for new and frequent users alike https t co adkwc skwl datainfrastructure openscience materialscience researchdata bigdata fairdata https t co nrr godlvo,Initiative
179,bei nfdi memory und nfdi objects werden wir von radar service unsere expertise u a auf den gebieten forschungsdaten management datenspeicherung publikation dissemination und fairdata einbringen nfdirocks nfdi forschung wissenschaft,Veranstaltung
180,tagung praktische probleme der kernresonanzspektroskopie https t co ojuxkgki j logs im universit ren service an der fsu jena gehalten von dr peter bellstedt eln lims sdms datarepository scientificdata fairdata https t co vodzswkkq,Veranstaltung
181,dzisiejsze szkolenie z elsevierconnect webinar opendata ord danebadawcze szkolenie komunikacjanaukowa fairdata openaccess bpk politechnikakrakowska https t co fykek xitt,Veranstaltung
182,our interactive tutorial on using nomad as an eln for fairdata is tomorrow there s still time to sign up at https t co dp ie cq,Veranstaltung
183,is your company a champion or pioneer in fairdata economy do u want to showcase your work to global mydata community do u want to shape the programme of the most impactful personaldata event of the year partner w us for mydata https t co f qyvquuu https t co yih uhara,Veranstaltung
184,newspecies new wasp from china just flew in diglyphus difasciatus treatment https t co xfrr tkp j publication https t co t pprawsm zookeys journal entomologyart royentsoc waspidcourse ishstudents fairdata nature biodiversity conservation insects wasps https t co cojf kw wj,Publikation
185,on march at pm et join the nih radx datahub partners for a presentation of metadata in the radxdatahub including a discussion of methods to create datamodels dataharmonization strategies fairdata best practices bigdata nihdatascience https t co td cuap pw,Veranstaltung
186,who is behind ad gd meet creaf ecologia the ecological and forestry applications research centre creaf is our project coordinator ecology their experience with citsci insitu networks and socioeconomic data will be of great value for fairdata integration https t co agasbqx e,Initiative
187,culturalchange beim teilen von forschungsdaten mit und durch die nfdi auftakt zur neuen veranstaltungsreihe cc by us mit konsortswd am uhr programm und anmeldung https t co b br tnuvw fairdata forschungsdatenmanagement https t co gl p hv vw,Veranstaltung
188,newspecies linaria pseudamethystea a newly discovered endemic plantaginaceae from spain holotype canalugr treatment https t co ujqustfvei publication https t co rg otcb f phytotaxa bgci oficialsebot kewgardens guiaverdecom fairdata biodiversity conservation https t co ywi eu pc,Publikation
189,side by side with gbif at gsb in dublin we are having our journal portfolio academic books partnering euprojects more on display our aim boost soilbiodiversity knowledge sharing in an open efficient fair manner thegsbi fairdata eubiodiversity https t co kzmlucwil,Veranstaltung
190,have you seen our short animation about the importance of marine data management share with a friend https t co xq nxhmrf metadatamonday marinedata datamanagement fairdata https t co ovxqgyjgmw,Initiative
191,next week our sofiemeeus from bgm coll res will talk at the rda europe plenary about bicikl h in the panel global research commons europe and beyond on pathways to community engagement focusing on research infrastructures taxonomic community and fairdata https t co ubl ozjugr,Veranstaltung
192,modificaci n de la ley sobre la reutilizaci n de informaci n del sector p blico de acuerdo a la estrategia de datos de la ue aspectos esenciales accesibilidad uso de formatos abiertos legibles por m quinas f ciles de localizar reutilizables con metadatos fairdata,Veranstaltung
193,newspecies new flattie spider from australia just appeared karaops durrantorum holotype wamuseum treatment https t co jvnbaxiubg publication https t co isebetapbw zootaxa wsc nmbe arachnologynews britishspiders arachnofiles fairdata nature conservation spider https t co zb csn,Publikation
194,newspecies new catfish from brazil just swam by imparfinis lepturus holotype mzusp treatment https t co t cjkxe du publication https t co niw s fin zootaxa neotropi ichsandherps fairdata nature biodiversity conservation science fish teamfish ichthyology https t co kjop fa lx,Publikation
195,our focus is set on supporting fairdata and working for a interoperableeurope we want to bridge the semantic and technology gaps which currently prevent multi disciplinary and multi scale access and exploitation of data interoperability,Initiative
196,calling all champions of open science don t miss the opportunity to support the implementation of fairdata in european openscience learn more and apply as eoscfairchampions https t co gufv zm deadline of application https t co ptzo bcec,Veranstaltung
197,last chance to join the fair impact eosc group of fair champions you ll have the opportunity to support the implementation of fairdata in european openscience the deadline for the open call is today don t miss this opportunity https t co elwpv vh https t co lpftxebzlt,Veranstaltung
198,our next nfdi tooltalk on march at pm is about the rdm platform coscine the service is for the storage management and archiving of research and metadata youtube https t co rursvam yg info https t co lme fbrs fdm fairdata https t co x apdmq m,Veranstaltung
199,h renswert forschungsdaten f r literaturreviews was und wozu https t co pru rxx m ein gespr ch mit unserer phd anw rterin carolin keller openscience opendata fairdata systematicreview forschungssynthesen,Meinung
200,cs mesh eosc is finalising its meeting in barcelona esade after a successful cs conference many actions agreed to finalise the development of the sciencemesh support cloud datasharing datasynchronisation sector https t co ljq bfcv n fairdata https t co ljq bfcv n https t co tr i amcks,Veranstaltung
201,fairsharing faircookbook our contributions to fairdata elixirnodeuk,Initiative
202,making data findable accessible interoperable reusable fair our researchers feature in elixirnodeuk films on the fair enabling resources for research in lifesciences beyond https t co tiesvpoowx susannaasansone allysonlister phil at oerc fairsharing org fairdata https t co nlh erecso,Veranstaltung
203,agriculturemdpi high cited paper title the role of fair data towards sustainable agricultural performance a systematic literature review authors basharat ali et al link https t co df kwhif fairdata findable accessible interoperable reusable sustainability https t co rqusla mov,Publikation
204,newspecies new glassfrog from brazil just climbed in on frogfriday vitreorana assuh holotype museudezoologia treatment https t co ahs r tutu publication https t co bez etpg zootaxa herphighlights amphibiansorg frogsandsuch amphibianrescue parcorg fairdata https t co bdtriwve,Publikation
205,newspecies new rove beetle from india just roved in syndicus primus holotype uniwroc treatment https t co jngrufwseu publication https t co m g rt icf zootaxa entomologyart coleopsoc nhm coleoptera entcollnet dailybugfriends fairdata nature conservation https t co puospzlwm,Publikation
206,two weeks until the openmod workshop hosted by the iiasavienna energy climate environment program learn about model comparison fairdata opensource tools messageix pyam iamc join the capacitybuilding sessions online wed march https t co hlrhuhftyo https t co aijrxxxli,Veranstaltung
